{
  "$schema": "../schemas/control.schema.json",
  "record_type": "control",
  "framework": "SOC2",
  "framework_version": "2017 TSC (revised points of focus 2022)",
  "control_id": "SOC2-CC7.3-001",
  "control_name": "Security Event Evaluation and Incident Declaration",
  "criterion": "CC7.3",
  "secondary_criteria": [
    "CC7.2",
    "CC7.4"
  ],
  "category": "security",
  "domain": "security_operations",
  "objective": "Apply defined criteria to decide whether a security event has affected, or could affect, the entity's ability to meet its objectives, so that incident declaration is a judgement made against a standard rather than an improvised call.",
  "description": "Security events surfaced by monitoring are evaluated against documented severity and impact criteria that determine whether the event is declared an incident. The evaluation, its outcome, and the person who made it are recorded for every event assessed, including those judged not to be incidents. Declaration triggers the incident response process. Criteria address confidentiality, availability, and integrity impact, and explicitly cover events reported from outside the monitoring pipeline such as customer reports and vulnerability disclosures.",
  "control_type": "detective",
  "automation_level": "manual",
  "frequency": "event_driven",
  "owner_role": "Security Engineering, with an accountable incident commander role defined",
  "applicability": {
    "always": true,
    "conditions": [
      "The entity operates a system in which security events can occur"
    ]
  },
  "implementation_guidance": [
    "Write the declaration criteria down. An undocumented threshold cannot be applied consistently and cannot be tested.",
    "Record the evaluation of events judged not to be incidents; without those records only declared incidents are visible and the control's discriminating function is unevidenced.",
    "Include intake paths other than monitoring: customer reports, researcher disclosures, vendor notifications, and staff reports.",
    "Define who may declare an incident and who may stand one down, and make both decisions attributable."
  ],
  "design_considerations": [
    "Are declaration criteria documented and specific enough to apply consistently?",
    "Do they cover confidentiality, availability, and integrity impact?",
    "Is there an intake path for events not surfaced by monitoring?"
  ],
  "operating_considerations": [
    "Were events evaluated within a defined timeframe?",
    "Are non-incident dispositions recorded, or only declared incidents?",
    "Was the criteria set applied consistently across the period?"
  ],
  "evidence_examples": [
    {
      "evidence_id": "EV-MONITOR-001",
      "necessity": "primary",
      "note": "Event population with evaluation outcome, including non-incident dispositions."
    },
    {
      "evidence_id": "EV-INCIDENT-001",
      "necessity": "primary",
      "note": "Declared incidents with the basis for declaration."
    }
  ],
  "policy_examples": [
    "POL-INCIDENT-001"
  ],
  "risks": [
    {
      "risk_id": "RSK-INCIDENT-001",
      "description": "A material event is judged routine because no threshold existed to judge it against, and the response never starts.",
      "inherent_severity": "critical"
    },
    {
      "risk_id": "RSK-INCIDENT-002",
      "description": "Events reaching the entity outside the monitoring pipeline have no intake path and are handled informally.",
      "inherent_severity": "high"
    }
  ],
  "common_findings": [
    "FND-INCIDENT-001"
  ],
  "remediation": [
    "REM-INCIDENT-001"
  ],
  "questionnaire_questions": [
    "QN-OPS-001-Q04"
  ],
  "related_controls": [
    {
      "control_id": "SOC2-CC7.2-001",
      "relationship": "depends_on",
      "note": "Evaluation operates on the anomalies monitoring surfaces."
    },
    {
      "control_id": "SOC2-CC7.4-001",
      "relationship": "supports",
      "note": "Declaration is what triggers the response process."
    }
  ],
  "mappings": [
    {
      "framework": "NIST-SP800-53r5",
      "external_id": "IR-4",
      "relationship": "partial",
      "source_id": "SRC-NIST-SP800-53R5",
      "confidence": "medium"
    },
    {
      "framework": "ISO-27001-2022",
      "external_id": "A.5.25",
      "relationship": "partial",
      "source_id": "SRC-ISO-27001-2022",
      "confidence": "high"
    },
    {
      "framework": "NIST-CSF-2.0",
      "external_id": "DE.AE",
      "relationship": "informs",
      "source_id": "SRC-NIST-CSF-2.0",
      "confidence": "medium"
    }
  ],
  "sources": [
    "SRC-AICPA-TSC-2017-R2022",
    "SRC-DG-AUDITOR-PRACTICE",
    "SRC-DG-BEST-PRACTICE"
  ],
  "source_refs": [
    {
      "source_id": "SRC-AICPA-TSC-2017-R2022",
      "locator": "TSC CC7.3",
      "authority_tier": 1,
      "supports": "Identity of the criterion this control is intended to help meet.",
      "verification_status": "verified"
    },
    {
      "source_id": "SRC-DG-AUDITOR-PRACTICE",
      "authority_tier": 4,
      "supports": "Design and operating considerations, and the points most commonly challenged in testing.",
      "verification_status": "interpretation"
    },
    {
      "source_id": "SRC-DG-BEST-PRACTICE",
      "authority_tier": 5,
      "supports": "Implementation guidance and DriftGuard's recommended approach.",
      "verification_status": "opinion"
    }
  ],
  "authority_tier_dominant": 4,
  "verification_status": "interpretation",
  "version": "0.1.0",
  "schema_version": "0.1.0",
  "status": "draft",
  "created": "2026-08-12",
  "last_reviewed": "2026-08-12",
  "notes": [
    "Kept separate from SOC2-CC7.4-001 because evaluation and response are designed, operated, and evidenced independently: an entity can have a mature response plan and no consistent declaration threshold, and the reverse is equally common."
  ]
}
